{"schema": "lattice.todo_extraction.v3", "project_id": "lattice", "plan_key": "carry-removal-retirement", "plan_version": "v1", "actor": {"host": "mac", "session": "bridge-recovery-20260811", "agent": "bell"}, "recorded_at": "2026-08-11T02:25:00.000Z", "tasks": [{"task_id": "cr1-refute", "title": "ADR 0167を実コードで反証し採用可否と代替案を出す", "lane": "audit", "design_memo": "実装前の敵対的検証。契約クリティカル（F）なので、設計が生き残るまで実装へ渡さない。\n\n殺す観点: ①削除宣言を悪用した意味変化の隠蔽 ②joins.afterからremovedを抜いた時の空after\n③removed→carry taskのincoming削除が履歴偽装にならないか ④acquire_phase/reset_pending/\ncarry_reconciled_metadataとの相互作用 ⑤retired状態を持たせる代替の方が安全か。\n\n根拠は実ファイルの行を引く。確信の持てない指摘は出さない。", "narrative_ref": "docs/plan_carry-removal-retirement.md", "compile_binding": null, "disposition": "register_pending", "start": null, "completion": null, "source": {"origin_plan_ref": "docs/plan_carry-removal-retirement.md", "origin_line": 52, "source_commit": "5afd284cd2b811f38479841efb95be646c460aaa", "heading_path": ["plan: 打ち切り工程の退役を可能にする（2026-08-11 campaign）", "ToDo"], "markdown_depth": 2, "parent_task_id": null, "checkbox_state": "unchecked"}, "migration_context": {"external_canonical_ref": null, "carry_over_ref": null, "h_required": false, "condition": null, "evidence_refs": [], "notes": []}}, {"task_id": "cr2-impl", "title": "carry判定の緩和を実装し削除以外の辺変化の拒否をtestで固定する", "lane": "implementation", "design_memo": "cr1の所見を条件として実装する。\n\n対象: src/todo-store.mjs の taskSemantics（2289付近）と phaseV3CarrySemantics（2325付近）。\n同revisionの task_migration で to_task_id:'removed' の集合を作り、predecessor側の意味論から\nその集合に触れる辺だけを落とす。**緩めるのは削除された相手への辺だけ**で、それ以外の\n辺の増減は従来どおり carry_semantics_changed で拒否する。\n\nacquire_phase経路（validateAcquirePhaseCarry・2409付近）も同じfilterを通す。\nreset_pendingは比較を通らない別系統なので触らない。\n\n受入の要: 緩和が「辺は変わってよい」へ広がっていないことをtestで証明する。", "narrative_ref": "docs/plan_carry-removal-retirement.md", "compile_binding": null, "disposition": "register_pending", "start": null, "completion": null, "source": {"origin_plan_ref": "docs/plan_carry-removal-retirement.md", "origin_line": 53, "source_commit": "5afd284cd2b811f38479841efb95be646c460aaa", "heading_path": ["plan: 打ち切り工程の退役を可能にする（2026-08-11 campaign）", "ToDo"], "markdown_depth": 2, "parent_task_id": null, "checkbox_state": "unchecked"}, "migration_context": {"external_canonical_ref": null, "carry_over_ref": null, "h_required": false, "condition": "cr1の反証所見を満たすこと", "evidence_refs": [], "notes": []}}, {"task_id": "cr3-adr", "title": "反証結果を反映してADR 0167をAcceptedへ確定する", "lane": "decision", "design_memo": "不変Decisionなので統括直轄。cr1で出た必須条件をDecisionへ書き込んでからAcceptedにする。\nProposedのまま実装を進めない。", "narrative_ref": "docs/plan_carry-removal-retirement.md", "compile_binding": null, "disposition": "register_pending", "start": null, "completion": null, "source": {"origin_plan_ref": "docs/plan_carry-removal-retirement.md", "origin_line": 54, "source_commit": "5afd284cd2b811f38479841efb95be646c460aaa", "heading_path": ["plan: 打ち切り工程の退役を可能にする（2026-08-11 campaign）", "ToDo"], "markdown_depth": 2, "parent_task_id": null, "checkbox_state": "unchecked"}, "migration_context": {"external_canonical_ref": null, "carry_over_ref": null, "h_required": false, "condition": "cr1完了後", "evidence_refs": [], "notes": []}}, {"task_id": "cr4-retire", "title": "bh5/bh6/bh7をreviseで退役させ工程表から消えたことを実測する", "lane": "deploy", "design_memo": "手元の生成script（narrative_anchor:null＋carry_reconciled_metadata＋cutover batch）を使う。\n\n罠: docs/plan_bridge-hub.md はToDo節が削除済みで、storeのanchorが指すL65-71が存在しない。\ncommit f673b881 から原本行を復元してからでないとcutoverが通らない（digest 7/7一致を確認済み）。\n\n受入は工程表の実表示で判定する。lattice todo status に bridge-hub が出ないこと。", "narrative_ref": "docs/plan_carry-removal-retirement.md", "compile_binding": null, "disposition": "register_pending", "start": null, "completion": null, "source": {"origin_plan_ref": "docs/plan_carry-removal-retirement.md", "origin_line": 55, "source_commit": "5afd284cd2b811f38479841efb95be646c460aaa", "heading_path": ["plan: 打ち切り工程の退役を可能にする（2026-08-11 campaign）", "ToDo"], "markdown_depth": 2, "parent_task_id": null, "checkbox_state": "unchecked"}, "migration_context": {"external_canonical_ref": null, "carry_over_ref": null, "h_required": false, "condition": "cr2完了後", "evidence_refs": [], "notes": []}}, {"task_id": "cr5-release", "title": "本修正を含む版をreleaseし全端末へ配って実測する", "lane": "release", "design_memo": "CHANGELOG追記→bump→commit→push→npm publish→Mac/WSL2へinstall→実測。\npublishはH。prepublishOnlyがworking treeのcleanと既定ブランチ祖先を要求する。", "narrative_ref": "docs/plan_carry-removal-retirement.md", "compile_binding": null, "disposition": "register_pending", "start": null, "completion": null, "source": {"origin_plan_ref": "docs/plan_carry-removal-retirement.md", "origin_line": 56, "source_commit": "5afd284cd2b811f38479841efb95be646c460aaa", "heading_path": ["plan: 打ち切り工程の退役を可能にする（2026-08-11 campaign）", "ToDo"], "markdown_depth": 2, "parent_task_id": null, "checkbox_state": "unchecked"}, "migration_context": {"external_canonical_ref": null, "carry_over_ref": null, "h_required": true, "condition": "cr3・cr4完了後。publishはオーナー承認が要る", "evidence_refs": [], "notes": []}}], "hard_dependencies": [{"from": {"project_id": "lattice", "plan_key": "carry-removal-retirement", "task_id": "cr1-refute"}, "to": {"project_id": "lattice", "plan_key": "carry-removal-retirement", "task_id": "cr2-impl"}}, {"from": {"project_id": "lattice", "plan_key": "carry-removal-retirement", "task_id": "cr1-refute"}, "to": {"project_id": "lattice", "plan_key": "carry-removal-retirement", "task_id": "cr3-adr"}}, {"from": {"project_id": "lattice", "plan_key": "carry-removal-retirement", "task_id": "cr2-impl"}, "to": {"project_id": "lattice", "plan_key": "carry-removal-retirement", "task_id": "cr4-retire"}}, {"from": {"project_id": "lattice", "plan_key": "carry-removal-retirement", "task_id": "cr3-adr"}, "to": {"project_id": "lattice", "plan_key": "carry-removal-retirement", "task_id": "cr5-release"}}, {"from": {"project_id": "lattice", "plan_key": "carry-removal-retirement", "task_id": "cr4-retire"}, "to": {"project_id": "lattice", "plan_key": "carry-removal-retirement", "task_id": "cr5-release"}}], "joins": [], "extraction_digest": "9947b299d6857fc72160f89ab3fedfc70d33aa4b95ecc43cb4452c95399b310b"}