{"actor":{"agent":"bell","host":"mac","session":"roundtable-exec-20260809"},"extraction_digest":"c696cc4d3c359c22847977c86fb656b77e463475f51dcb7c9225d94cab27a499","hard_dependencies":[{"from":{"plan_key":"start-retract-20260809","project_id":"lattice","task_id":"st1"},"to":{"plan_key":"start-retract-20260809","project_id":"lattice","task_id":"st2"}}],"joins":[],"plan_key":"start-retract-20260809","plan_version":"v1","project_id":"lattice","recorded_at":"2026-08-09T09:00:07.090Z","schema":"lattice.todo_extraction.v3","tasks":[{"compile_binding":null,"completion":null,"design_memo":"誤startを取り消す面。撤回は履歴の削除ではなく追記——新journal event（start_retracted・reason必須・actor束縛）を積み、projectionがin-progress→pendingへ戻す。撤回できるのは自分のstartだけ。**active intakeが在る間のretractはtyped errorで拒否**（r1 open-flowはliteral start eventへ束縛するため。intakeのrelease/abandonが先）。負のコントロール: pending/done/blockedへのretract・他actorのretract・intake中のretractが全部typed error。既存store読み口は加算互換。CLIの語彙は実装者の判断。設計境界の正本は docs/plan_start-retract.md。","disposition":"register_pending","lane":"lattice","migration_context":{"carry_over_ref":null,"condition":null,"evidence_refs":[],"external_canonical_ref":null,"h_required":false,"notes":[]},"narrative_ref":"docs/plan_start-retract.md","source":{"checkbox_state":"absent","heading_path":["着手の撤回（start-retract-20260809）","工程","st1 撤回の実装（Lattice）"],"markdown_depth":4,"origin_line":30,"origin_plan_ref":"docs/plan_start-retract.md","parent_task_id":null,"source_commit":"0048a752424f043f2d4ee382d94427746c8f646a"},"start":null,"task_id":"st1","title":"st1 撤回の実装（Lattice）"},{"compile_binding":null,"completion":null,"design_memo":"受入条件5つで固定: ①実planでstart→retract→next_ready復帰→別席がstartできる ②t19型の誤start状態が再現でき、retractで正直な状態へ戻る ③pull intake中のretract拒否・release後に通る ④負のコントロール4種がtyped error ⑤既存planのstatus/gantt/advisoryが無変更。実測中の発見はgateへ足さず外へ出す。","disposition":"register_pending","lane":"gate","migration_context":{"carry_over_ref":null,"condition":null,"evidence_refs":[],"external_canonical_ref":null,"h_required":false,"notes":[]},"narrative_ref":"docs/plan_start-retract.md","source":{"checkbox_state":"absent","heading_path":["着手の撤回（start-retract-20260809）","工程","st2 受入: 実測（親立会い）"],"markdown_depth":4,"origin_line":34,"origin_plan_ref":"docs/plan_start-retract.md","parent_task_id":null,"source_commit":"0048a752424f043f2d4ee382d94427746c8f646a"},"start":null,"task_id":"st2","title":"st2 受入: 実測（親立会い）"}]}
