{"schema": "lattice.todo_extraction.v3", "project_id": "lattice", "plan_key": "campaign-closeout-20260811", "plan_version": "v1", "actor": {"host": "mac", "session": "bridge-recovery-20260811", "agent": "bell"}, "recorded_at": "2026-08-11T06:37:35.000Z", "tasks": [{"task_id": "co1-deploy-record", "title": "0.57.3の配備記録を追記する", "lane": "docs", "design_memo": "`docs/operations/lattice-kitepon-deployment.md`へ2026-08-11 v0.57.3の節を足す。\n\n書くこと: 対象commit・npm版・各端末への反映方法と実測値（Mac CLI/常駐bridgeのruntime.version、\nWSL2のCLI版、FOXのcarry over理由）・公開面の応答・今回踏んだ罠。\n\n**罠として残す価値があるもの**: インストール版CLIと source tree のずれ（publish後の修正は\nインストール版に無いので `node bin/lattice.mjs` で回す必要がある）。今日 revise と run intake の\n両方でこれに当たった。", "narrative_ref": "docs/plan_campaign-closeout-20260811.md", "compile_binding": null, "disposition": "register_pending", "start": null, "completion": null, "source": {"origin_plan_ref": "docs/plan_campaign-closeout-20260811.md", "origin_line": 38, "source_commit": "112a9fb57e7fa781fd5eac0e5ec08bbba19089c2", "heading_path": ["plan: 2026-08-11 campaign群の締め（closeout）", "ToDo"], "markdown_depth": 2, "parent_task_id": null, "checkbox_state": "unchecked"}, "migration_context": {"external_canonical_ref": null, "carry_over_ref": null, "h_required": false, "condition": null, "evidence_refs": [], "notes": []}}, {"task_id": "co2-retire-bpr6", "title": "裁定で不要となったbpr6を退役revisionで工程から外す", "lane": "implementation", "design_memo": "オーナー裁定2026-08-11でbpr6-offline-noticeは不要と決まったが、当時は末尾taskの退役が\n表現できず行として残った。ADR 0167の緩和が0.57.3で入ったので、いま退役できる。\n\n`.lattice/tools/build-bh-retire-revision.mjs`が bridge-hub 用の実例である。同じ形で\nbridge-persistence-recoveryのrevisionを組む。**回すのは `node bin/lattice.mjs todo revise`**。\n\n罠: cutoverは散文の原本行が実在することを要求する。`docs/plan_bridge-persistence-recovery.md`の\n該当行が現存するか先に確認すること。入力は canonical bytes（1行JSON＋末尾LF）。\n\nbpr5-fox-installは退役しない。あれはオーナー待ちの生きた工程である。", "narrative_ref": "docs/plan_campaign-closeout-20260811.md", "compile_binding": null, "disposition": "register_pending", "start": null, "completion": null, "source": {"origin_plan_ref": "docs/plan_campaign-closeout-20260811.md", "origin_line": 39, "source_commit": "112a9fb57e7fa781fd5eac0e5ec08bbba19089c2", "heading_path": ["plan: 2026-08-11 campaign群の締め（closeout）", "ToDo"], "markdown_depth": 2, "parent_task_id": null, "checkbox_state": "unchecked"}, "migration_context": {"external_canonical_ref": null, "carry_over_ref": null, "h_required": false, "condition": null, "evidence_refs": [], "notes": []}}, {"task_id": "co3-plan-status", "title": "完了plan文書のStatusと正本記述を実態へ合わせる", "lane": "docs", "design_memo": "3件ある。\n\n1. `docs/plan_carry-removal-retirement.md` の `Status: Active` を完了の実態へ。\n2. `docs/plan_bridge-persistence-recovery.md` の同上（bpr5だけが残る状態を明記）。\n3. `docs/plan_bridge-hub.md` の末尾が「工程・ToDoはLattice store `bridge-hub` v1が唯一の正本」と\n   書いているが、実際の正本は `rev-2110d106ce415b7e3144039e` で、原本行は\n   `docs/archive/plan_bridge-hub_tasks.md` へ移設済みである。**版を焼き込まない書き方**へ直し、\n   archiveへの参照を足す。\n\n散文が実態とずれたまま残ると、次に読むAIが古い版を正本と誤認する。今日それで実際に\ncutoverの前提が崩れていた（anchorが指す行が散文から消えていた）。", "narrative_ref": "docs/plan_campaign-closeout-20260811.md", "compile_binding": null, "disposition": "register_pending", "start": null, "completion": null, "source": {"origin_plan_ref": "docs/plan_campaign-closeout-20260811.md", "origin_line": 40, "source_commit": "112a9fb57e7fa781fd5eac0e5ec08bbba19089c2", "heading_path": ["plan: 2026-08-11 campaign群の締め（closeout）", "ToDo"], "markdown_depth": 2, "parent_task_id": null, "checkbox_state": "unchecked"}, "migration_context": {"external_canonical_ref": null, "carry_over_ref": null, "h_required": false, "condition": null, "evidence_refs": [], "notes": []}}, {"task_id": "co4-knowledge", "title": "『同じものを2箇所で別々に定義すると噛み合わなくなる』形を正典へ還流する", "lane": "knowledge", "design_memo": "今日3回、同じ構造の欠陥を踏んだ。\n\n1. 端末が**配信している集合**と**hubへ名乗る集合**を別々に数えていた（ADR 0165）\n2. 常駐設定の**書き手**と**読み手**で、半端な状態の扱いが違った（ADR 0166）\n3. witness setの**書き手**（compile --input）と**読み手**（readTodoWitnessSet）で、\n   canonical bytesの要求が違った\n\nどれも「誰も嘘をついていないのに噛み合わない」形で、症状は別の場所に出る。既にADRが3本\nあるので新しいADRは作らない。**この3本を貫く一般形**を、次に同じ場面へ来たAIが引ける所へ置く。\n\n置き場の候補: AGENTS.mdの実装規範、または罠DB。**どちらか一方**にする（二重化しない）。\n記録には3件の実例と、検出の勘所（同じ概念を2箇所が別々に計算していないか）を含める。", "narrative_ref": "docs/plan_campaign-closeout-20260811.md", "compile_binding": null, "disposition": "register_pending", "start": null, "completion": null, "source": {"origin_plan_ref": "docs/plan_campaign-closeout-20260811.md", "origin_line": 41, "source_commit": "112a9fb57e7fa781fd5eac0e5ec08bbba19089c2", "heading_path": ["plan: 2026-08-11 campaign群の締め（closeout）", "ToDo"], "markdown_depth": 2, "parent_task_id": null, "checkbox_state": "unchecked"}, "migration_context": {"external_canonical_ref": null, "carry_over_ref": null, "h_required": false, "condition": null, "evidence_refs": [], "notes": []}}], "hard_dependencies": [{"from": {"project_id": "lattice", "plan_key": "campaign-closeout-20260811", "task_id": "co2-retire-bpr6"}, "to": {"project_id": "lattice", "plan_key": "campaign-closeout-20260811", "task_id": "co3-plan-status"}}], "joins": [], "extraction_digest": "6227aa5b346af644f65142293f54e394e8b73916a9962438bd7bf8357a474df8"}