{
  "schema": "lattice.todo_extraction.v3",
  "project_id": "lattice",
  "plan_key": "todo-store-atomic-commit-20260809",
  "plan_version": "v1",
  "actor": {
    "host": "mac",
    "session": "roundtable-exec-20260809",
    "agent": "mio"
  },
  "recorded_at": "2026-08-09T10:02:11.000Z",
  "tasks": [
    {
      "task_id": "ac1",
      "title": "ac1 atomic store commit実装",
      "lane": "lattice",
      "design_memo": "共通Git dir上の機械ロック、store clean preflight、独立indexによるstore path限定commit、HEAD競合検査、失敗時のstore rollback、typed診断を実装する。start/done/note/phase state/witness系を同じ明示atomic入口で扱い、既存の指定なしwriteは加算互換で残す。dirty sourceと他者stageを不変に保つ負側、lock競合、commit失敗rollbackをfocused testで固定する。設計契約はdocs/plan_todo_store_atomic_commit.md。",
      "narrative_ref": "docs/plan_todo_store_atomic_commit.md",
      "compile_binding": null,
      "disposition": "register_pending",
      "start": null,
      "completion": null,
      "source": {
        "origin_plan_ref": "docs/plan_todo_store_atomic_commit.md",
        "origin_line": 49,
        "source_commit": "bb486a2092c5ad10bf37fd89f1ef9f464d71424e",
        "heading_path": [
          "ToDo store書込みとGit着地のatomic化（todo-store-atomic-commit-20260809）",
          "工程",
          "ac1 atomic store commit実装"
        ],
        "markdown_depth": 3,
        "parent_task_id": null,
        "checkbox_state": "absent"
      },
      "migration_context": {
        "external_canonical_ref": null,
        "carry_over_ref": null,
        "h_required": false,
        "condition": null,
        "evidence_refs": [
          "room [1541]-[1561]",
          "room [1572]-[1579]"
        ],
        "notes": [
          "オーナー裁定2026-08-09の緊急割込み"
        ]
      }
    },
    {
      "task_id": "ac2",
      "title": "ac2 実repo受入と運用配線",
      "lane": "gate",
      "design_memo": ".team/scripts/done.shをatomic入口へ配線し、意図的なsource dirtyと既存stageを残した実repoでstore mutationが照会なしにcommitまで完了することを実測する。source bytes・index不変、store path限定commit receipt、既存writeの加算互換、sensor clean gate不変を確認して証跡化する。ac1受入後だけ開始する。",
      "narrative_ref": "docs/plan_todo_store_atomic_commit.md",
      "compile_binding": null,
      "disposition": "register_pending",
      "start": null,
      "completion": null,
      "source": {
        "origin_plan_ref": "docs/plan_todo_store_atomic_commit.md",
        "origin_line": 55,
        "source_commit": "bb486a2092c5ad10bf37fd89f1ef9f464d71424e",
        "heading_path": [
          "ToDo store書込みとGit着地のatomic化（todo-store-atomic-commit-20260809）",
          "工程",
          "ac2 実repo受入と運用配線"
        ],
        "markdown_depth": 3,
        "parent_task_id": null,
        "checkbox_state": "absent"
      },
      "migration_context": {
        "external_canonical_ref": null,
        "carry_over_ref": null,
        "h_required": false,
        "condition": "ac1 accepted",
        "evidence_refs": [],
        "notes": []
      }
    },
    {
      "task_id": "ac3",
      "title": "ac3 publish・global install・campaign smoke",
      "lane": "gate",
      "design_memo": "関連gate green後にpackage publishとglobal installを行い、global CLIがatomic入口を公開することを確認する。campaign残作業の実store mutationを新入口で1件完了し、共通lock、path限定commit receipt、source dirty非干渉をsmokeする。publish対象commitはmain祖先確認を必須とし、失敗を旧CLIへfallbackしない。",
      "narrative_ref": "docs/plan_todo_store_atomic_commit.md",
      "compile_binding": null,
      "disposition": "register_pending",
      "start": null,
      "completion": null,
      "source": {
        "origin_plan_ref": "docs/plan_todo_store_atomic_commit.md",
        "origin_line": 61,
        "source_commit": "bb486a2092c5ad10bf37fd89f1ef9f464d71424e",
        "heading_path": [
          "ToDo store書込みとGit着地のatomic化（todo-store-atomic-commit-20260809）",
          "工程",
          "ac3 publish・global install・campaign smoke"
        ],
        "markdown_depth": 3,
        "parent_task_id": null,
        "checkbox_state": "absent"
      },
      "migration_context": {
        "external_canonical_ref": null,
        "carry_over_ref": null,
        "h_required": false,
        "condition": "ac2 accepted",
        "evidence_refs": [],
        "notes": [
          "オーナーがpublishとglobal installまで明示認可"
        ]
      }
    }
  ],
  "hard_dependencies": [
    {
      "from": {
        "project_id": "lattice",
        "plan_key": "todo-store-atomic-commit-20260809",
        "task_id": "ac1"
      },
      "to": {
        "project_id": "lattice",
        "plan_key": "todo-store-atomic-commit-20260809",
        "task_id": "ac2"
      }
    },
    {
      "from": {
        "project_id": "lattice",
        "plan_key": "todo-store-atomic-commit-20260809",
        "task_id": "ac2"
      },
      "to": {
        "project_id": "lattice",
        "plan_key": "todo-store-atomic-commit-20260809",
        "task_id": "ac3"
      }
    }
  ],
  "joins": [],
  "extraction_digest": "036985a6ac2e3466e122e79c95baaf2bba11c5d52dafac764c24e3975d5455db"
}
