{"actor":{"agent":"bell","host":"mac","session":"roundtable-exec-20260809"},"extraction_digest":"7ad7c7a43dc1266e77f48095375eac2eca88969e70852d14514d955ed07e8067","hard_dependencies":[{"from":{"plan_key":"scope-split-viz-20260809","project_id":"lattice","task_id":"v1"},"to":{"plan_key":"scope-split-viz-20260809","project_id":"lattice","task_id":"v2"}}],"joins":[],"plan_key":"scope-split-viz-20260809","plan_version":"v1","project_id":"lattice","recorded_at":"2026-08-09T05:11:06.870Z","schema":"lattice.todo_extraction.v3","tasks":[{"compile_binding":null,"completion":null,"design_memo":"`parent_task_id`の系譜で、親taskの箱の内側に子task群の依存DAGを工程図として描く。行の折り畳みではない——外から見れば親は1個の箱のまま、開くと箱の内側に内部工程図（graphvizのcluster相当・再帰可）。対象はtodo-gantt-html／layout／svg／presentation。親を持たないtaskだけのplanでは現行描画と完全一致（後方互換の負のコントロール）。データはまず合成fixture（parent_task_id入りのplan）で作る。scope-split s3の成果を待たずに着手できる。","disposition":"register_pending","lane":"lattice","migration_context":{"carry_over_ref":null,"condition":null,"evidence_refs":[],"external_canonical_ref":null,"h_required":false,"notes":[]},"narrative_ref":"docs/plan_todo-scope-expansion.md","source":{"checkbox_state":"absent","heading_path":["宣言の膨張を観測し、AIへToDo分割を促す（scope expansion signal）","入れ子表示の工程（plan_key `scope-split-viz-20260809`・オーナー裁定で本波へ昇格）","v1 入れ子gantt描画（Lattice）"],"markdown_depth":4,"origin_line":156,"origin_plan_ref":"docs/plan_todo-scope-expansion.md","parent_task_id":null,"source_commit":"b0572e652af8c8ae394bba39f5399225b9b465bf"},"start":null,"task_id":"v1","title":"v1 入れ子gantt描画（Lattice）"},{"compile_binding":null,"completion":null,"design_memo":"受入条件（実測）: ①s3のsplitが作った実データ（parent_task_id系譜）で入れ子が描ける ②再帰（箱の中の箱）が1段以上動く ③親無しplanの描画が無変更 ④公開工程表（gantt serve）で見える。受入条件はこの4つで固定——実測中の発見はgateへ足さず外へ出す。","disposition":"register_pending","lane":"gate","migration_context":{"carry_over_ref":null,"condition":null,"evidence_refs":[],"external_canonical_ref":null,"h_required":false,"notes":[]},"narrative_ref":"docs/plan_todo-scope-expansion.md","source":{"checkbox_state":"absent","heading_path":["宣言の膨張を観測し、AIへToDo分割を促す（scope expansion signal）","入れ子表示の工程（plan_key `scope-split-viz-20260809`・オーナー裁定で本波へ昇格）","v2 入れ子表示の受入（親立会い）"],"markdown_depth":4,"origin_line":162,"origin_plan_ref":"docs/plan_todo-scope-expansion.md","parent_task_id":null,"source_commit":"b0572e652af8c8ae394bba39f5399225b9b465bf"},"start":null,"task_id":"v2","title":"v2 入れ子表示の受入（親立会い）"}]}
