{"actor":{"agent":"tsumugi","host":"mac","session":"roundtable-exec-20260809"},"extraction_digest":"1f5ae94857a2cc938711e3d759c3ee47a47659b87f96de4bc282efc7c7475d5e","hard_dependencies":[],"joins":[],"plan_key":"roundtable-carryover-20260809","plan_version":"v1","project_id":"lattice","recorded_at":"2026-08-09T05:00:00.000Z","schema":"lattice.todo_extraction.v3","tasks":[{"compile_binding":null,"completion":null,"design_memo":"`run activate`はrun全体の前景駆動器で、ready frontierが空になるまで戻らず進捗を一切出さない。外形（lifecycle lock保持・control ledger in_progress・CPUゼロ）がhangと区別できず、t19-live-1で実際に誤診が起きた（pid停止とlock削除を実行手順へ載せる寸前まで進んだ）。`run observe`／`run status`へ`driver_state`と`waiting_on`をtypedで出し、helpにも「activateは全wave完了まで戻らない前景駆動器」を書く。**受入は文言追加では足りず、別processから待ち状態がtypedで読めること**とする。負の対照として、driver停止中と駆動中で値が変わることをfocused testで固定する。","disposition":"register_pending","lane":"lattice","migration_context":{"carry_over_ref":null,"condition":null,"evidence_refs":[],"external_canonical_ref":null,"h_required":false,"notes":[]},"narrative_ref":"docs/plan_roundtable-execution-integration.md","source":{"checkbox_state":"absent","heading_path":["円卓×Lattice実行層統合 campaign（roundtable-exec-20260809）","申し送りWave — roundtable-carryover-20260809（t19の実戦投入の題材）","k1 前景駆動器が何を待っているかを外から見えるようにする（Lattice）"],"markdown_depth":4,"origin_line":202,"origin_plan_ref":"docs/plan_roundtable-execution-integration.md","parent_task_id":null,"source_commit":"ae3ab6dd3c4f4012c9a36f4a5025efd154d80cd1"},"start":null,"task_id":"k1","title":"k1 前景駆動器が何を待っているかを外から見えるようにする（Lattice）"},{"compile_binding":null,"completion":null,"design_memo":"旧installがwork-order入りrun storeを読むと`INVALID_RUN_STORE`としか言わず原因に辿り着けない（t7申し送り⑤）。**既に配布済みのbinaryを新版から直すことは原理的にできない**ので、対象を今後の世代差に限る: 期待versionと更新手順を含むtyped診断を出す。t20 publishより前のdependency。旧installの検知とupgrade案内はdotagentsの所有（将来の導入・更新・互換性）なので本taskに含めない。","disposition":"register_pending","lane":"lattice","migration_context":{"carry_over_ref":null,"condition":null,"evidence_refs":[],"external_canonical_ref":null,"h_required":false,"notes":[]},"narrative_ref":"docs/plan_roundtable-execution-integration.md","source":{"checkbox_state":"absent","heading_path":["円卓×Lattice実行層統合 campaign（roundtable-exec-20260809）","申し送りWave — roundtable-carryover-20260809（t19の実戦投入の題材）","k2 schema世代差をtyped `unsupported version`として診断する（Lattice）"],"markdown_depth":4,"origin_line":209,"origin_plan_ref":"docs/plan_roundtable-execution-integration.md","parent_task_id":null,"source_commit":"ae3ab6dd3c4f4012c9a36f4a5025efd154d80cd1"},"start":null,"task_id":"k2","title":"k2 schema世代差をtyped `unsupported version`として診断する（Lattice）"}]}
